Date ,Species ,Location ,"City, Country",Origin,Transit,Destination,Weight (kg) ,Number,Airline ,Flight Number,Mode of Transport,Method of Detection,Obfuscation Method,Notes ,Source,Photo 1,Photo 2,Photo 3,,,,,,,,,,,,,,,,
9-Feb-09,Ploughshare Tortoises,Hong Kong Airport,"Hong Kong, China",Thailand,,"Hong Kong, China",,2,,,Luggage,canine; intelligence,none; food boxes,21 hedgehogs and 23 sugar gliders also seized. One arrest.,TRAFFIC Bulletin 1997 - 2016;  https://www.afcd.gov.hk/english/publications/publications_press/pr1087.html,,,,,,,,,,,,,,,,,,,
20-Feb-09,Shingleback Lizards; bluetongue lizards; three Black-headed Pythons; albino Carpet Python,Sydney Airport,"Sydney, Australia","Sydney, Australia",,"Bangkok, Thailand",,44,,,Luggage,X-ray,socks; cloth bags,"24 Shingleback Lizards, 16 bluetongue lizards, three Black-headed Pythons, and one albino Carpet Python (endangered - numbers may be as low as 100). One Australian man arrested.",TRAFFIC Bulletin 1997 - 2016;  http://www.abc.net.au/news/2009-02-23/44-reptiles-seized-at-sydney-airport/305672; http://www.telegraph.co.uk/news/newstopics/howaboutthat/4786263/Man-smuggled-snakes-into-Australia-in-suitcase.html,,,,,,,,,,,,,,,,,,,
1-Mar-09,Ball Pythons,,United Kingdom,USA,,,,26,,,Unknown,,,Seized by UK Border Agency CITES team,TRAFFIC Bulletin 1997- 2014; https://cites.org/sites/default/files/reports/09-10UnitedKingdom.pdf,,,,,,,,,,,,,,,,,,,
9-Jul-09,Ploughshare Tortoises,Kaohsiung Airport,"Kaohsiung, Taiwan",China,,"Kaohsiung, Taiwan",,1,,,Luggage,,,Ploughshare tortoise is CITES I. was found concealed in the luggage of a businessman returning from China,TRAFFIC Bulletin 1997 - 2016,,,,,,,,,,,,,,,,,,,
1-May-09,Tortoises,Ivato Airport,"Antananarivo, Madagascar","Antananarivo, Madagascar",,,,,,,Unknown,,,One Ploughshare found in a shipment of tortoises. The Ploughshare had been previously seized ^ and was stolen from a conservation trust in Madagascar,TRAFFIC Bulletin 1997 - 2016,,,,,,,,,,,,,,,,,,,
10-Sep-09,Lizards,Roissy Airport,"Paris, France","Niamey, Niger","Paris, France","Miami, USA",155,193,,,Airfreight,,,Nine boxes arrived in Paris. Two labelled as Sahara Mastigures (CITES II). Illegal in Niger to export wild specimens of this species. The other seven were legal species.,TRAFFIC Bulletin 1997 - 2016,,,,,,,,,,,,,,,,,,,
29-Aug-09,Chinese Box Turtles,Kaohsiung Airport,"Kaohsiung, Taiwan","Kaohsiung, Taiwan",,"Hong Kong, China",,1255,,,Airfreight,,,"Declared as Chinese Stripe Neck Turtles, discovered in the air freight export area. Chinese Box Turtles are CITES II",TRAFFIC Bulletin 1997-2014; http://www.nownews.com/n/2009/08/31/825651,,,,,,,,,,,,,,,,,,,
10-Sep-09,Uromastyz Geyris Lizards,Roissy Airport,"Paris, France",Niger,"Paris, France","Florida, USA",,188,,,Airfreight,Lack of paperwork,,"The two boxes of lizards, which is a protected species, were part of a batch of nine boxes; only 7 of the 9 cases had certificates authorizing the export of chameleons and reptiles, yellow or red lizards; this species is banned by CITES",http://www.la-croix.com/Semaine-en-images/188-lezards-proteges-saisis-a-l-aeroport-de-Roissy-_NG_-2009-09-18-539389,,,,,,,,,,,,,,,,,,,
11-Nov-09,Tortoises,Taipei Airport,"Taipei, Taiwan",China,,"Taipei, Taiwan",,57,Air Macau,,Luggage,,,27 Radiated Tortoises (CITES I) and 30 Leopard Tortoises (CITES II) concealed in personal luggage. One suspect arrested.,TRAFFIC Bulletin 1997 - 2016; http://taipei.Customs.gov.tw/ct.asp?xItem=43988&ctNode=7306,,,,,,,,,,,,,,,,,,,
17-Nov-09,Skinks; Geckos; Lizards,Los Angeles Airport,"Los Angeles, USA",Australia,,"Los Angeles, USA",,15,,,Passenger - Clothing/Items,,,suspect arrested and sentenced after admitting to at least two other successful previous smuggling instances. The lizards were put in money belts fastened around the chest.,http://www.nbclosangeles.com/news/local/suspected-LAX-Lizard-Smuggler-Sentence-125089899.html; http://www.nydailynews.com/news/national/michael-plank-arrested-los-angeles-international-airport-strapping-15-lizards-chest-article-1.416385,,,,,,,,,,,,,,,,,,,
20-Nov-09,Tortoises,Taipei Airport,"Taipei, Taiwan",China,,,,30,,,Unknown,,,"8 Radiated Tortoises, 22 Leopard Tortoises, and 116 birds of 13 species. One suspect arrested.",TRAFFIC Bulletin 1997 - 2016,,,,,,,,,,,,,,,,,,,
6-Dec-09,Sticky-Toed Geckos; skinks,Christchurch Airport,"Christchurch, New Zealand","Christchurch, New Zealand",,"Frankfurt, Germany",,44,,,Passenger - Clothing/Items,Baggage search,"Hidden in baggage and a ""purpose-built body pack concealed in Kubus's underwear""","The lizards were found in a hand-sewn pouch in his underwear. German national, Hans Kurt Kubus was sentenced and fined. Sticky-toed geckos are CITES III. 24 Sticky-toed geckos and 20 skinks were discovered. One was found during a baggage search, and the other 43 were discovered in the suspect's underwear. All the reptiles had been illegally collected from the wild. Kubus plead guilty to seven charges (two under the Wildlife Act and five CITES violations) and was convicted on all charges. He was sentenced to a fine of NZD5000 (usD3500), or NZD1000 per CITES violation, and 14 weeks' imprisonment",TRAFFIC Bulletin 1997- 2014; http://www.nbcnews.com/id/35087361/ns/world_news-world_environment/t/man-jailed-over-lizards-briefs/; http://www.doc.govt.nz/news/media-releases/2010/lizard-smuggler-sentenced/; ,,,,,,,,,,,,,,,,,,,
2-Mar-10,Pig-Nosed Turtles; Indochinese Rattlesnakes,Soekarno Hatta Airport,"Jakarta, Indonesia","Jakarta, Indonesia",,"Hong Kong, China",2200,4100,Cathay Pacific Flight,,Airfreight,"""Two tons of fresh fruit"" alerted customs to unusual activity","Declared as ""fresh fruit"" cargo","Exported by a company identified as ""IDT PD"" located west of Jakarta; the two people in charge of the cargo were interviewed but could not immediately be suspects without further investigation",http://la.tartuga.blog.lr.over-blog.com/article-contrebande-de-serpents-et-de-tortues-dejouee-48297150.html,,,,,,,,,,,,,,,,,,,
3-Apr-10,Dyeing Dart Frogs,Rochambeau airport,"Cayenne, French Guiana",,,,,44,,,Unknown,intelligence,,"""A traveler arrested at Rochambeau airport. He carried with him protected frogs.""; suspect is a German citizen of Greek origin and was monitored for ""a few days""; frogs from Amazon basin; the frogs are colorful and toxic; suspect was arrested",http://archives-lepost.huffingtonpost.fr/article/2010/04/05/2019923_saisie-de-grenouilles-vivantes-par-les-douanes-de-guyane.html; http://www.30millionsdamis.fr/actualites/article/1768-saisie-de-grenouilles-toxiques-et-protegees-en-guyane/,,,,,,,,,,,,,,,,,,,
14-May-10,Spur-Thighed Tortoises,Edmonton Airport,"Edmonton, Canada",United Kingdom,,"Edmonton, Canada",,3,,,Luggage,canine,cardboard boxes,Spur-thighed Tortoises (CITES II) found with prohibited plant material and food,TRAFFIC Bulletin 1997 - 2016; http://www.cbc.ca/news/canada/edmonton/tortoises-in-suitcases-seized-at-edmonton-airport-1.933883,,,,,,,,,,,,,,,,,,,
23-May-10,Indian Star Tortoises,Hazrat Shahjalal Airport,"Dhaka, Bangladesh","Chennai, India","Dhaka, Bangladesh",Malaysia,,480,Malaysia Airlines,,Luggage,,,"Indian Star Tortoises (CITES II). One Malaysia-bound Indian national arrested. One source says seizure occurred on May 30, rather than May 24",TRAFFIC Bulletin 1997 - 2016; http://www.ifaw.org/united-states/news/seizure-indian-airport-results-rescue; http://bdnews24.com/bangladesh/2010/05/24/indian-held-with-480-rare-turtles; Omega 12,,,,,,,,,,,,,,,,,,,
1-Jun-10,Radiated Tortoises; Kapikas; ploughshare tortoises; spider tortoises,Kuala Lumpur Airport,"Kuala Lumpur, Malaysia",Madagascar,,"Kuala Lumpur, Malaysia",,300,Air Mauritius,,Luggage,,,"The animals were locked in two bags, which also contained drugs; 285 radiated tortoises, 14 kapika turltes, the pyxis arachnoid tortoises, angonoka tortule and a ploughshare tortoises (very rare); turtles are alive and were looking at being repatriated back to Madagascar; the three species of turtles are in Appendix I of CITES",http://mg.chm-cbd.net/news/trafic-de-tortues-de-madagascar,,,,,,,,,,,,,,,,,,,
1-Jul-10,radiated tortoises; ploughshare tortoises; tomato frogs,Kuala Lumpur Airport,"Kuala Lumpur, Malaysia",Madagascar,,,,415,,,Luggage,,,"Four hundred Radiated Tortoises (CITES I), 11 Spider Tortoises, and four Ploughshare Tortoises. Two women were arrested and sentenced to a year in prison",TRAFFIC Bulletin 1997 - 2016; http://www.bbc.com/news/world-asia-pacific-10674741; http://www.livescience.com/11063-case-missing-tortoises-returned-madagascar.html,,,,,,,,,,,,,,,,,,,
8/??/2010,Indian Star Tortoises; Pig-Nosed Turtles; White-Front Box Turtles,Honolulu Airport,"Honolulu, USA","Osaka, Japan",,"Honolulu, USA",,42,,,Luggage,intelligence,,"Indian Star Tortoises (CITES II), White-front Box turtles (CITES I), Pig-Nosed Turtles (CITES II). One arrest and conviction. The trafficker claimed that he was paid by Atsushi Yamagami. This seizure spawned 'Operation Flying Turtle' by the U.S. Fish and Wildlife Service to catch Yamagami and his smuggling ring.",https://www.justice.gov/sites/default/files/enrd/legacy/2015/04/13/October_2010.pdf ; http://www.mercurynews.com/ci_20515148/business-special-reports,,,,,,,,,,,,,,,,,,,
26-Aug-10,Boa Constrictors,Kuala Lumpur Airport,"Kuala Lumpur, Malaysia","Penang, Malaysia","Kuala Lumpur, Malaysia","Jakarta, Indonesia",,95,,,Luggage,Snakes got out,,"The snakes got out of the luggage and were crawling on the carousel; suspect was Keng Liang Wong and he was arrested, not his first time trafficking as he has already served a sentence of 6 years in prison after being arrested in 1998 for smuggling protected reptile species; suspect nicknamed ""Lizard King""",http://www.journaldequebec.com/2010/09/03/serpents-a-bord-une-histoire-pas-si-loin-de-la-realite; http://archives-lepost.huffingtonpost.fr/article/2010/09/14/2221243_le-trafiquant-de-reptiles-condamne-mais.html; https://www.theguardian.com/environment/2010/sep/03/smuggler-boa-constrictors,,,,,,,,,,,,,,,,,,,
28-Sep-10,Indian Star Tortoises,Suvarnabhumi Airport,"Bangkok, Thailand",India,Bangladesh,"Bangkok, Thailand",,1140,,,Luggage,,,Indian Star Tortoises (CITES II) in four suitcases. Believed to have been destined for Bangkok's Chatuchak weekend market. One arrest-potentiallly a Pakistani national.,TRAFFIC Bulletin 1997 - 2016,,,,,,,,,,,,,,,,,,,
11-Oct-10,Tortoises,Suvarnabhumi Airport,"Bangkok, Thailand",Madagascar,"Nairobi, Kenya","Bangkok, Thailand",,218,Kenya Airlines,,Luggage,,,217 Radiated Tortoises and one Ploughshare found in two suitcases (all CITES I) on baggage claim,https://www.terresacree.org/actualites/1643/actualite-des-tortues-en-danger-de-disparition-saisies-en-thailande-47979?filtre=recherche,,,,,,,,,,,,,,,,,,,
2-Dec-10,Reticulated Pythons; blood pythons,Abu Dhabi Airport,"Abu Dhabi, UAE",Indonesia,"Abu Dhabi, UAE","Abu Dhabi, UAE",,4,Etihad Airlines,,Luggage,,,"Additionally, 2 parrots and a squirrel were found with the snakes. Indonesian officials suspect assistance from airport security in Jakarta.",http://www.homelandsecuritynewswire.com/smuggled-snakes-expose-flaws-indonesian-airport-security,,,,,,,,,,,,,,,,,,,
7-Jan-11,Pig-Nosed Turtles; Star Tortoises; Chinese Soft-Shell Turtles; Indian Flap Turtles; Chinese Big-Headed Turtles; Snail Eating Turtles,Los Angeles Airport,"Los Angeles, USA",Japan,,"Los Angeles, USA",,55,,,Luggage,,Snack food boxes,"15 Pig-Nosed Turtles (CITES II), 14 Snail Eating Turtles (CITES II), 3 Chinese Big-headed Turtles (CITES II), 5 Indian Flap Turtles (CITES II), Chinese Soft Shelled Turtles (CITES II), Star Tortoises (Either CITES I or CITES II) were discovered in 5 japanese candy packages, wrapped in cloth along with $16,112 of undeclared currency. Animals were recovered alive and two japanese nationals were arrested. This seizure was the culmination of 'Operation Flying Turtle' by the U.S. Fish and Wildlife Service",https://www.cbp.gov/newsroom/local-media-release/2011-01-11-050000/55-live-turtles-found-passengers-luggage-lax ; http://www.laweekly.com/news/feds-find-55-turtles-illegally-smuggled-into-lax-stuffed-in-snack-food-boxes-2397649,,,,,,,,,,,,,,,,,,,
31-Jan-11,Tortoises,Soekarno Hatta Airport,"Jakarta, Indonesia","Jakarta, Indonesia",,,,8,,,Luggage,X-ray,,Singaporean man was arrested also carrying two Bali Myna birds and four slow lorises (CITES II). Pig-nosed turtles are listed as CITES I,TRAFFIC Bulletin 1997 - 2016; http://www.traffic.org/home/2011/2/19/rare-birds-and-other-wildlife-seized-at-jakarta-airport-duri.html,,,,,,,,,,,,,,,,,,,
1-Feb-11,Reptiles,Munich Airport,"Munich, Germany",Indonesia,,"Munich, Germany",,152,,,Airfreight,,,"The reptiles were bound for a German trader. Green tree pythons were among the specimens, many of which died after the seizure",https://cites.org/sites/default/files/reports/11-12Germany.pdf,,,,,,,,,,,,,,,,,,,
9-Feb-11,Indian Star Tortoises; Ball Pythons; Elongated Tortoises; Bearded Dragons; Radiated Tortoises; Argentine Horned Frogs; Mata mata Turtles; Spiny Tailed Lizards; Striped Narrow-Headed Turtles; Aldabra Troiteses; Boa Constrictors; Sudan Plated Lizards; Corn Snakes; King Snakes; Ploughshare Toirtoises; Pig-nosed Turtles; milk snakes; hog-nosed snakes,Suvarnabhumi Airport,"Bangkok, Thailand","Bangkok, Thailand",,,,257,,,Luggage,X-ray,,"88 Indian Star Tortoises (CITES II), 34 Ball pythons (CITES II), 33 Elongated Tortoises(CITES II), 19 Bearded Dragons, 7 Radiated tortoises (CITES I), 6 Argentine Horned Frogs, 4 Mata Mata Turtles, 4 Spiny Tailed Lizards, 4 Striped Narrow-headed turtles (CITES II), 3 Aldabra Tortoises(CITES II), 2 Boa Constrictors (CITES I), 2 Sudan Plated Lizards, 2 Corn Snakes, 2 King Snakes, 1 Ploughshare Tortoise(CITES I), 1 Pig-nosed Turtle(CITES II), 1 Milk Snake, 1 Hog nosed Snake. Also found 22 common squirrels, 18 baboon spider and 1 African grey parrot. One arrest. The man had purchased all the animals at Chatuchak Market (An outdoor market in Bangkok). The animals were found in three suitcases",http://www.ecoworld.com/animals/birds/; http://www.worldwildlife.org/stories/snakes-on-a-plane-and-turtles-and-spiders-and,,,,,,,,,,,,,,,,,,,
11-Feb-11,Indian Star Tortoises; Lizards; Pythons; Boa Constrictors; Ploughshare Tortoises; Yellow-headed turtles,Suvarnabhumi Airport,"Bangkok, Thailand","Bangkok, Thailand",,,,185,,,Luggage,X-ray,,"suspect aged 34 was about to bard the plane; 88 Indian star turtles, 33 yellow-headed turtle and ploughshare tortoise (very rare protected species), 2 boa constrictors, 34 pythons, 18 tarantulas, squirrels, several species of lizards and a Gray Gabon parrot; majority of the reptiles were neclosed in plastic boxes and others were founded in different compartments in suitcases; value estimated at 18,000 euros",http://www.maxisciences.com/trafic/des-centaines-d-039-animaux-rares-saisis-en-thailande_art12504.html,,,,,,,,,,,,,,,,,,,
22-Feb-11,Naja Naja Cobras,Tallinn Airport,"Tallinn, Estonia",,,"Tallinn, Estonia",,1,,,Luggage,,,,https://cites.org/sites/default/files/reports/11-12Estonia.pdf,,,,,,,,,,,,,,,,,,,
25-Mar-11,Pythons,Soekarno Hatta Airport,"Jakarta, Indonesia","Jakarta, Indonesia",,"Dubai, UAE",,40,Emirates Airlines,,Luggage,X-ray,,Two arrests. The suspects were Kuwaiti nationals. Snakes were sedated and the suspects intended to sell the pythons to collectors in the UAE.,http://www.aljazeera.com/news/asia-pacific/2011/03/2011327639407224.html,,,,,,,,,,,,,,,,,,,
1-May-11,Reticulated Pythons,,Italy,Indonesia,,Italy,,200,,,Luggage,,,Reticulated Pythons (CITES II),https://cites.org/sites/default/files/eng/com/sc/62/Inf/E62i-03.pdf,,,,,,,,,,,,,,,,,,,
1-May-11,Spur-Thighed Tortoises,,United Kingdom,Turkey,,United Kingdom,,15,,,Unknown,,,Spur-thighed Tortoises (CITES II),https://cites.org/sites/default/files/eng/com/sc/62/Inf/E62i-03.pdf,,,,,,,,,,,,,,,,,,,
16-May-11,Chameleons; Frogs; Lizards ,Ivato Airport,"Antananarivo, Madagascar","Antananarivo, Madagascar",,China,,557,,,Luggage,X-ray,Pockets in wicker baskets; plastic bottles with leaves inside,"Total of 557 animals protected under Appendix II of CITES; 467 chameleons, 23 lizards and 58 frogs; 5 chameleons and 4 lizards found dead; Malagasy citizen (40 years old) was charged and charged with Customs fraud; trying to ship the animals to China",http://www.jacaranda.fr/2011/05/17/faits-divers-ivato-saisie-de-557-animaux-menaces/,,,,,,,,,,,,,,,,,,,
5/17/2011 to 5/26/2011,Snakes; Crocodiles,Roissy Airport,"Paris, France",,,,460,,,,Unknown,,,Part of an operation from the OCLAESP; 9 people were arrested,http://www.rtl.fr/actu/societe-faits-divers/des-viandes-de-crocodiles-antilopes-elephants-saisis-a-roissy-7690069074,,,,,,,,,,,,,,,,,,,
2-Jun-11,Indian Star Tortoises,Shahjalal Airport,"Dhaka, Bangladesh",India,"Dhaka, Bangladesh",Malaysia,,480,,,Luggage,,,"A wildlife expert identified five species through photos of the seizure: Sylheti Roof Turtle (CITES II), Spotted Pond Turtle (likely same as Black Pond Turtle, CITES I), Bengal-eyed turtle (CITES I), Asian Leaf Turtle (CITES II), and Shila Turtle (Black Pond Turtles, CITES I).",http://www.thedailystar.net/news-detail-188349,,,,,,,,,,,,,,,,,,,
10-Jun-11,Indian Star Tortoises; Burmese Star Tortoises,Suvarnabhumi Airport,"Bangkok, Thailand","Dhaka, Bangladesh",Japan,"Bangkok, Thailand",,431,,,Luggage,,,"Indian and Burmese Star Tortoises (CITES II). Found in unclaimed bags. Loading tags suggested bags had originally come from Dhaka, Bangladesh before going to Japan via Bangkok, and then coming back to Bangkok to be collected. Four tortoises had died, they had been in the bags for about 10 days. Other sources say there were 400 turtles and other rare reptiles, including gavials (CITES I). Found in four suitcases on June 2, according to some sources. One source claims there were 35 star tortoises, and that the animals were found in suitcases at Suvarnabhumi Airport on the way to India.",TRAFFIC Bulletin 1997 - 2016; Omega 12; http://www.thedailystar.net/news-detail-188349,,,,,,,,,,,,,,,,,,,
1-Jul-11,Reticulated Pythons,,,Indonesia,,Netherlands,,170,,,Airfreight,,,Reticulated Pythons (CITES II),https://cites.org/sites/default/files/eng/com/sc/62/Inf/E62i-03.pdf,,,,,,,,,,,,,,,,,,,
12-Jul-11,Tortoises; Frogs; Bearded Dragons,Suvarnabhumi Airport,"Bangkok, Thailand",,,"Hong Kong, China",,19,SriLankan Airlines,,Luggage,X-ray,,"Two Radiated Tortoises (CITES I), four Indian Star Tortoises (CITES II), three Bearded Dragons, and 10 unidentified frogs on a Chinese national bound for Hong Kong",TRAFFIC Bulletin 1997 - 2016,,,,,,,,,,,,,,,,,,,
17-Jul-11,Snakes,Suvarnabhumi Airport,"Bangkok, Thailand","Bangkok, Thailand",,Iran,,50,Mahan Air,,Luggage,,Stuffed in socks,Various species purchased at Chauhak Market. Iranian national arrested was already suspected of involvement in an animal smuggling ring,http://www.bangkokpost.com/archive/Customs-prevent-snakes-on-a-plane-scenario/247392 ; https://seattle99.wordpress.com/2011/07/17/,,,,,,,,,,,,,,,,,,,
25-Jul-11,Radiated Tortoises; Spur Tortoises,Ivato Airport,"Antananarivo, Madagascar","Antananarivo, Madagascar",,"Nairobi, Kenya",,196,Kenya Airways,,Luggage,X-ray,In cardboard packets in suitcases,"suspects were Indian and Malagasy, they were arrested; in Appendix I and II of CITES",http://www.afriquinfos.com/2011/07/26/brevesdafrique-183398.php,,,,,,,,,,,,,,,,,,,
16-Aug-11,Indian Star Tortoises,Kuala Lumpur Airport,"Kuala Lumpur, Malaysia","Dhaka, Bangladesh",,,,589,,,Luggage,,,Indian Star Tortoises are CITES II. Found in two unclaimed luggage bags. Repatriated to India in Dec 2011.,TRAFFIC Bulletin 1997 - 2016; http://www.bernama.com.my/bernama/v8/newsindex.php?id=608814; Omega 12,,,,,,,,,,,,,,,,,,,
25-Aug-11,Snakes; Turtles,Miami Airport,"Miami, USA","Miami, USA",,Brazil,,10,,,Passenger - Clothing/Items,Wave Screener (not x-ray),,"Wrapped in nylon bags stuffed in man's pants. suspect was charged under the Laceey act. 7 snnakes, 3 turtles",http://miami.cbslocal.com/2011/08/29/tsa-no-snakes-on-this-plane/ ; http://www.cbsnews.com/news/tsa-man-arrested-in-miami-trying-to-smuggle-snakes-turtles-in-his-pants/,,,,,,,,,,,,,,,,,,,
26-Aug-11,Snakes; Turtles,Kuala Lumpur Airport,"Kuala Lumpur, Malaysia","Penang, Malaysia","Kuala Lumpur, Malaysia","Jakarta, Indonesia",,98,,,Luggage,,,"95 Boa constrictors, 2 rhinocerous vipers, 1 mata-mata turtle. Anson Wong Keng Liang was sentenced.",http://www.traffic.org/home/2010/9/6/international-wildlife-trafficker-sentenced-to-6-months-in-m.htm l; http://www.thestar.com.my/news/nation/2012/02/22/wildlife-trader-anson-wong-freed-after-court-reduces-jail-term/,,,,,,,,,,,,,,,,,,,
29-Aug-11,Snakes,Munich Airport,"Munich, Germany","Sydney, Australia",,"Munich, Germany",,36,,,Luggage,Routine check,,"The suspect is an Australian man aged 22 who was returning to Munich from Syndy, he was arrested; the pythons were white and 30cm long on average, rare specimens",http://www.aeronautique.ma/Aeroport-de-Munich-36-serpents-dans-les-bagages-d-un-passager-australien_a2190.html,,,,,,,,,,,,,,,,,,,
3-Sep-11,Angonoky Spur Turtles,Mahajanga-Amborovy Airport,"Mahajanga, Madagascar","Mahajanga, Madagascar",,"Bangkok, Thailand",,93,,,Luggage,X-ray,Wrapped in baby diapers in small plastic baskets,"92 baby turtles, 1 adult; name of Nivolalao (I think); during routine search","http://www.madagascar-tribune.com/93-tortues-interceptees-a-l,16357.html",,,,,,,,,,,,,,,,,,,
20-Oct-11,Sea Turtle Eggs,Bush Interncontinental Airport,"Houston, USA",El Salvador,,"Houston, USA",,12,,,Luggage,,,Eggs were turned over to U.S. fish and Wildlife Service and sent to undergo DNA analysis,https://www.cbp.gov/newsroom/local-media-release/2011-10-20-040000/cbp-Houston-prohibit-eggs-endangered-sea-turtle,,,,,,,,,,,,,,,,,,,
7-Nov-11,Indian Star Tortoises; snakes,Soekarno Hatta Airport,"Jakarta, Indonesia",India,"Bangkok, Thailand","Jakarta, Indonesia",,80,,,Passenger - Clothing/Items,,,"75 Indian Star Tortoises (CITES II) and ""Various snakes"" found in the possession of an Indonesian woman returning from Bangkok. 28 tortoises died - 27 were already dead when she was stopped. 19 tortoises later repatriated to India. One source claims there were only 47 tortoises total.",TRAFFIC Bulletin 1997 - 2016 ; http://empowerednews.net/indian-star-tortoises-sent-home/1821229/,,,,,,,,,,,,,,,,,,,
1-Dec-11,Graceful Chameleons,,United Kingdom,Ghana,United Kingdom,Japan,,95,,,Unknown,,,Graceful Chameleons (CITES II),https://cites.org/sites/default/files/eng/com/sc/62/Inf/E62i-03.pdf,,,,,,,,,,,,,,,,,,,
7-Dec-11,Lizards; snakes,Buenos Aires Airport,"Buenos Aires, Argentina","Buenos Aires, Argentina",Spain,"Prague, Czech Republic",,247,Iberia Airlines,,Luggage,X-ray,,"10 Boa Constrictors, poisonous pit vipers, coral snakes, lizards and spiders. Animals were labeled by latin name in Various plastic containers, bags and socks. Several specimens died prior to discovery. A Czech national was arrested and charged. He is believed to be part of a larger smuggling ring due to his short stay in Argentina and the large number and variety of specimens from across South America; suspect named as Karel Abelovsky, 51",http://www.csmonitor.com/World/Americas/2011/1228/Snakes-on-a-plane-almost-in-Argentina https://solarsy.wordpress.com/2011/12/29/les-serpents-venimeux-dans-les-bagages-a-laeroport-de/,,,,,,,,,,,,,,,,,,,
11-Dec-11,Sea Turtle Eggs,Bush Interncontinental Airport,"Houston, USA",El Salvador,,"Houston, USA",,25,,,Luggage,,,"While species were unspecified, all were described as endangered. Eggs were turned over to U.S. Fish and Wildlife Service.",https://www.cbp.gov/newsroom/local-media-release/2011-12-13-050000/cbp-seizes-endangered-sea-turtle-eggs-Houston,,,,,,,,,,,,,,,,,,,
3-Jan-12,Hawksbill; Green Turtles,Puerto Princesa Airport,"Puerto Princesa, Philippines",,,"Puerto Princesa, Philippines",91,40,,,Airfreight,,,"Four boxes of pangolin scales (CITES II) and four boxes of shells from about 40 Green and Hawkville turtles (both CITES I). Boxes were signed by ""Novelito Rendon"", and were destined to be delivered to ""Renato Aloyan"" in Taboan, Cebu City ",TRAFFIC Bulletin 1997 - 2016; http://webcache.googleusercontent.com/search?q=cache:fDGVgUt_j1MJ:news.abs-cbn.com/nation/regions/01/03/12/anteater-scales-turtle-shells-seized-palawan+&cd=1&hl=en&ct=clnk&gl=us http://www.pangolins.org/2012/01/04/philippines-pangolin-scales-and-flesh-seized-at-airport/,,,,,,,,,,,,,,,,,,,
4-Jan-12,Chameleons,Zaventem Airport,"Brussels, Belgium","Entebbe, Uganda","Brussels, Belgium",Germany,,204,,,Unknown,,,The permits required by CITES had been issues but the authorized for export quota was exceeded by 14 units in this case; a quarter of the animals are in poor health and 7 had already died,http://www.rtbf.be/info/societe/detail_plus-de-200-cameleons-saisis-a-l-aeroport-de-bruxelles?id=7343803,,,,,,,,,,,,,,,,,,,
22-Jan-12,Turtles,Jomo Kenyatta Airport,"Nairobi, Kenya","Antananarivo, Madagascar","Nairobi, Kenya","Hanoi, Vietnam",400g each,2,,,Passenger - Clothing/Items,The Kenyan Customs officers noticed that the two individuals walked funny,Pants,"The men are Malagasy nationals, the men were brought to trial 3 ays after the arrest; suspects said they were a wedding gift; they were fined by the court ",http://www.matin.mg/?p=23137,,,,,,,,,,,,,,,,,,,
22-Jan-12,Spur-Thighed Tortoises,Malta Airport,"Luqa, Malta",,,,,15,,,Unknown,,,,,,,,,,,,,,,,,,,,,,,
25-Jan-12,Pig-Nosed Turtles,Mopah Airport,"Merauke, Indonesia",,,"Jakarta, Indonesia",,1500,,,Luggage,,,Pig-Nosed Turtles (CITES II) in two suitcases,TRAFFIC Bulletin 1997 - 2016,,,,,,,,,,,,,,,,,,,
8-Feb-12,Pig-Nosed Turtles,Mopah Airport,"Merauke, Indonesia",,,,,690,,,Luggage,,,690 juveniles. Living turtles from this and previous ^ seizure were released into the wild. 218 of the turtles died in quarantine,TRAFFIC Bulletin 1997 - 2016,,,,,,,,,,,,,,,,,,,
