Date ,Species ,Location ,"City, Country",Origin,Transit,Destination,Weight (kg) ,Number,Airline ,Flight Number,Mode of Transport,Method of Detection,Obfuscation Method,Notes ,Source,Photo 1,Photo 2,Photo 3,,,,,,,,,,,,,,,,
24-Sep-14,Diamondback Terrapins; Albino Florida Turtles; Chinese Red-Necked Turtles; Blandings Turtles; Wood Turtles,Detroit Airport,"Detroit, USA","Detroit, USA",,China,,1007,,,Luggage,,,"700 diamond back terrapins (CITES II), 16 Chinese Red-necked turtles(CITES II), wood turtles(CITES II), blanding turtles (CITES II). The turtles were concealed in snow boots and cereal boxes, and were being carried by a courier working for a Canadian citizen who had a recent arrest for wildlife trafficking. Two arrests. The two had worked together extensively.",http://www.robindesbois.org/wp-content/uploads/ON_THE_TRAIL_6.pdf,,,,,,,,,,,,,,,,,,,
24-Sep-14,Reptiles; Amphibians; Tadpoles; Boa Constrictor; Glass Frogs,Juan Santamaria Airport,"San Jose, Costa Rica","San Jose, Costa Rica",Panama,Germany,,496,,,Luggage,,,Boa constrictor (CITES II). German tourist packed the animals into plastic boxes. Most animals were already dead. ,http://www.robindesbois.org/wp-content/uploads/ON_THE_TRAIL_6.pdf,,,,,,,,,,,,,,,,,,,
27-Sep-14,Radiated Tortoises,Guangzhou Airport,"Guangzhou, China",Madagascar,"Bangkok, Thailand","Guangzhou, China",,195,,,Luggage,,,Radiated tortoises (CITES I) were found with 8 lizards. All were found alive.,http://www.robindesbois.org/wp-content/uploads/ON_THE_TRAIL_6.pdf,,,,,,,,,,,,,,,,,,,
5-Nov-14,Black Pond Turtles,Suvarnabhumi Airport,"Bangkok, Thailand","Dhaka, Bangladesh",,"Bangkok, Thailand",,669,,,Luggage,,,"Thai Customs officials seized 669 Black Pond Turtles (CITES I). The turtles were found inside the eight suitcases of four Bangladeshi passengers upon their arrival in Bangkok from Dhaka. The suspects initially evaded arrest, but one day later, Suvarnabhumi Airport authorities arrested three men for smuggling turtles for a wildlife trafficking gang (Pongsak Puyapan, Wanas Hatawiset, and Pariwat Hannarong). All three worked as porters for a contracting company. They initially denied involvement, but eventually admitted that they were paid 500 baht each to deliver the suitcases to someone in the airport parking lot.",http://namnewsnetwork.org/v3/read-photo.php?id=MTY5NjE=; Omega 12,,,,,,,,,,,,,,,,,,,
14-Dec-14,Radiated Tortoises,Roissy Airport,"Paris, France",Madagascar,"Paris, France",Laos,,170,,,Airfreight,,False bottom of crates filled with sea cucumbers,"Radiated tortoises (CITES I) were discovered in 6 crates, 15 died shortly after being discovered. ",TRAFFIC Bulletin 1997 - 2016; http://www.thelocal.fr/20141229/endangered-tortoises-found-at-paris-airport,,,,,,,,,,,,,,,,,,,
15-Dec-14,Indian Narrow-Headed Soft-Shelled Turtles,Hazrat Shahjalal Airport,"Dhaka, Bangladesh","Dhaka, Bangladesh",,Malaysia,,510,,,Luggage,Tip-off,,Indian narrow-headed soft-shelled Turtles (CITES I/II). Authorities acted on a tip-off and searched a bag(s) that had been abandoned near Gate 1 in the heavy baggage gate area of the airport.,http://www.robindesbois.org/wp-content/uploads/ON_THE_TRAIL_7.pdf; http://www.thedailystar.net/510-tortoises-seized-at-dhaka-airport-55512; http://en.prothom-alo.com/bangladesh/news/57107/510-tortoises-rescues-at-Dhaka-airport; https://www.youtube.com/watch?feature=player_embedded&v=z2Jr-BxACKk,,,,,,,,,,,,,,,,,,,
19-Dec-14,Common Water Monitors,Shanghai Pudong Airport,"Shanghai, China",,,"Shanghai, China",,3,,,Luggage,,,Common Water monitors (CITES II) were held in a briefcase as gifts for friends.,http://www.robindesbois.org/wp-content/uploads/ON_THE_TRAIL_7.pdf,,,,,,,,,,,,,,,,,,,
1-Jan-15,Pig-Nosed Turtles,Soekarno Hatta Airport,"Jakarta, Indonesia",,,"Jakarta, Indonesia",,5284,,,Airfreight,,,Pig-nosed Turtles (CITES II) hidden in a shipment of shellfish,http://www.robindesbois.org/wp-content/uploads/ON_THE_TRAIL_8.pdf,,,,,,,,,,,,,,,,,,,
1-Jan-15,Pig-Nosed Turtles,Ngurah Rai Airport,"Denpasar, Indonesia","Timika, Indonesia",,"Denpasar, Indonesia",,2350,,,Unknown,,,Pig-nosed turtles (CITES II),http://www.robindesbois.org/wp-content/uploads/ON_THE_TRAIL_8.pdf,,,,,,,,,,,,,,,,,,,
7-Jan-15,Black Pond Turtles,Changi Airport,Singapore,"Dhaka, Bangladesh",Singapore,"Surabaya, Indonesia",,190,,,Luggage,,,"Black Pond Turtles (CITES I). The turtles came from india, and all turtles either died in transport or were put down. The three pieces of luggage were lined with diapers and clothes. One arrest.",,,,,,,,,,,,,,,,,,,,
8-Jan-15,Monitor Lizards,Julius Nyerere Airport,"Dar es Salaam, Tanzania","Dar es Salaam, Tanzania",,,,149,,,Luggage,,,Monitor Lizards (CITES I/II) ,http://www.robindesbois.org/wp-content/uploads/ON_THE_TRAIL_8.pdf,,,,,,,,,,,,,,,,,,,
17-Jan-15,Pig-Nosed Turtles,Soekarno Hatta Airport,"Jakarta, Indonesia","Jakarta, Indonesia",Singapore,"Shanghai, China",,2350,Singapore Airlines,,Airfreight,,,Pig-nosed Turtles (CITES I) were discovered inside 10 containers labelled as mangrove crabs.,TRAFFIC Bulletin 1997 - 2016; http://www.traffic.org/home/2015/1/23/more-than-2300-turtles-seized-at-jakarta-international-airpo.html,,,,,,,,,,,,,,,,,,,
22-Jan-15,Pig-Nosed Turtles,Ngurah Rai Airport,"Denpasar, Indonesia","Timika, Indonesia","Denpasar, Indonesia",,,5284,,,Luggage,,,Pig-nosed Turtles (CITES I) were found in boxes and luggage. Three people were detained.,TRAFFIC Bulletin 1997 - 2016; http://www.traffic.org/home/2015/1/23/more-than-2300-turtles-seized-at-jakarta-international-airpo.html,,,,,,,,,,,,,,,,,,,
1-Feb-15,Turqouise Dwarf Geckos,Heathrow Airport,"London, United Kingdom",,,"London, United Kingdom",,165,,,Unknown,,,,http://www.robindesbois.org/wp-content/uploads/ON_THE_TRAIL_8.pdf,,,,,,,,,,,,,,,,,,,
6-Feb-15,Reptiles,Perth Airport,"Perth, Australia","Perth, Australia",,,,157,,,Luggage,,,"The animals were concealed in Various manner including hollowed out books and cigarette packets. Among the lizards were skinks, geckos, frogs and pygmy pythons. 33 of the reptiles were dead when they were intercepted. Two Russian citizes and two Czech citizens were arrested, and two of the men were allegedly carrying reptiles in their luggage at the time of their arrest.",TRAFFIC Bulletin 1997 - 2016; http://newsroom.border.gov.au/releases/traffickers-attempt-to-export-hundreds-of-reptiles-from-wa,,,,,,,,,,,,,,,,,,,
11-Feb-15,Geckos,Zavantem Airport,"Brussels, Belgium",,,,,18,,,Unknown,,,"The geckos were found with 20 butterflies, and sticks partially made of pangolin scales with falsified CITES documents. The species came from Tanzania, thailand and india.",http://www.robindesbois.org/wp-content/uploads/ON_THE_TRAIL_8.pdf,,,,,,,,,,,,,,,,,,,
20-Feb-15,Pig-Nosed Turtles; snakes; geckos,Suvarnabhumi Airport,"Bangkok, Thailand","Bangkok, Thailand",,Japan,,144,,,Luggage,,,Pig-nosed Turtles (CITES II). Two arrests.,TRAFFIC Bulletin 1997 - 2016,,,,,,,,,,,,,,,,,,,
1-Mar-15,Snakes ; beetles; lizards; frogs,Kuwait Airport,"Kuwait City, Kuwait",,,,,,,,Luggage,,,2 Kuwaitis arrested after importing species from Europe,http://www.robindesbois.org/wp-content/uploads/ON_THE_TRAIL_8.pdf,,,,,,,,,,,,,,,,,,,
24-Mar-15,Black Pond Turtles,Tiruchirappalli Airport,"Tiruchirappalli, India","Tiruchirappalli, India","Kuala Lumpur, Malaysia","Bangkok, Thailand",,492,Malindo Air,,Luggage,Scanner,Concealed in Various pieces of cloth and kept in five stroller bags,"492 Black pond turtles (CITES I) were being carried by 5 passengers who were caught and arrested at the gate by officers of the Directorate of Revenue Intelligence (DRI) and Customs Air Intelligence Unit (AIU). The turtles had been hidden in ""Various pieces of cloth"" and were stored in five stroller bags that were being carried by the suspects (Ahmed Kabir, 46, Ahmed Badhusha Marika, 40, Mohammad Salim, 28, Sayed Ahmed, 58, and Mohammed Iqbal, 42). The suspects' cell phones and passports were also seized. The accused admitted that they had received the turtles in Tiruchi and were transporting them for Rs. 10,000 each. ",http://www.robindesbois.org/wp-content/uploads/ON_THE_TRAIL_8.pdf; http://timesofindia.indiatimes.com/city/trichy/492-tortoises-seized-at-Trichy-airport-5-arrested/articleshow/46682975.cms; http://www.thehindu.com/news/cities/Tiruchirapalli/492-live-terrapins-seized-at-tiruchi-airport/article7030051.ece,,,,,,,,,,,,,,,,,,,
24-Mar-15,Black Pond Turtles,Hazrat Shahjalal Airport,"Dhaka, Bangladesh",,,India,,113,,,Unknown,Tip-off,Four bags,"A joint team of WCCU, Customs, and Armed Police Battalion (APBn) seized 113 tortoises from two Indian nationals after conducting a raid near Gate No. 6 around 10 pm. The tortoises were found in four bags.",http://www.thedailystar.net/city/113-tortoises-rescued-dhaka-airport-73520 ; Omega 12,,,,,,,,,,,,,,,,,,,
25-Mar-15,Turquoise Dwarf Geckos; Bearded Pygmy Chameleons; Peacock Tree Frogs; Whip Scorpions; Yellow Headed Geckos,Heathrow Airport,"London, United Kingdom",Tanzania,,"London, United Kingdom",,671,,,Airfreight,,,One arrest was made in connection with the shipment.,TRAFFIC Bulletin 1997 - 2016; https://www.gov.uk/government/news/endangered-geckos-seized-by-border-force-at-heathrow,,,,,,,,,,,,,,,,,,,
1-Apr-15,Asian Brown Pond Turtles; Japanese Pond Turtles,Chubu Airport,"Nagoya, Japan","Nagoya, Japan",,,,500,,,Luggage,,,"Japanese pond turtles (CITES II) and Asian brown pond turtles were wrapped in socks, belly to belly. ",http://www.robindesbois.org/wp-content/uploads/ON_THE_TRAIL_9.pdf,,,,,,,,,,,,,,,,,,,
1-Apr-15,Crocodiles,Yantai Airport,"Yantai, China",,,,,86,,,Unknown,,,Crocodiles (CITES I/II),http://www.robindesbois.org/wp-content/uploads/ON_THE_TRAIL_9.pdf,,,,,,,,,,,,,,,,,,,
1-Apr-15,Nile Crocodiles,Dusseldorf Airport,"Dusseldorf, Germany",Mauritius,"St. Petersburg, Russia","Dusseldorf, Germany",,1,,,Luggage,,,Nile crocodile (CITES I/II). One arrest. The skin was intended for the suspect's mother.,http://www.robindesbois.org/wp-content/uploads/ON_THE_TRAIL_9.pdf,,,,,,,,,,,,,,,,,,,
1-Apr-15,Reptiles,Domodedovo Airport,"Moscow, Russia","Jakarta, Indonesia",Qatar,"Moscow, Russia",,108,,,Luggage,,,"55 snakes,
2 baby crocodiles (CITES I/II),
35 lizards, 7 turtles, also found: 6 lemurs, 2 apes, one leopard cub. One arrest. All animals survived the trip except the baby crocodiles. The animals were packed in mini-cages, plastic boxes and bags.",http://www.robindesbois.org/wp-content/uploads/ON_THE_TRAIL_9.pdf,,,,,,,,,,,,,,,,,,,
4-Apr-15,Radiated Tortoises; spider tortoises,Ivato Airport,"Antananarivo, Madagascar","Antananarivo, Madagascar",,Taiwan,,11,,,Luggage,,,"9 Radiated Tortoises (CITES I), 2 Spider tortoises (CITES I), were found in the luggage of a Taiwanese couple disguised with charging wires. They bribed a local wildlife guide to steal the animals from a local breeding and rehabilitation center.",http://www.robindesbois.org/wp-content/uploads/ON_THE_TRAIL_9.pdf,,,,,,,,,,,,,,,,,,,
10-Apr-15,Black Pond Turtles,Chatrapati Shivaji Airport,"Mumbai, India","Mumbai, India",,"Kuala Lumpur, Malaysia",,183,,,Luggage,,,"183 turtles (45 Spotted Black Terrapins - Black Pond Turtles, CITES I) were found by Customs wrapped in tape and packaged in two suitcases. Two suspects, Saiyed Ibrahim Sickender and Sahajan Naina Mohammad, were trying to smuggle the turtles to Kuala Lumpur in their check-in luggage. At least two of the turtles later died.",http://www.robindesbois.org/wp-content/uploads/ON_THE_TRAIL_9.pdf ; http://www.hindustantimes.com/mumbai/mumbai-airport-Customs-rescue-183-turtles-being-smuggled-to-malaysia/article1-1336773.aspx,,,,,,,,,,,,,,,,,,,
21-Apr-15,Black Pond Turtles,Allama Iqbal Airport,"Lahore, Pakistan","Lahore, Pakistan",,"Bangkok, Thailand",,504,,,Luggage,,,"504 Black Pond Turtles (CITES I) seized by the Punjab Wildlife Department on their way to Bangkok and two suspects arrested. The suspects had come from Karachi, and had been told they were carrying seafood items. The suspects were fined Rs. 300,000.",http://tribune.com.pk/story/873757/wildlife-smuggling-504-turtles-seized-from-bangkok-bound-smugglers/ ; http://www.robindesbois.org/wp-content/uploads/ON_THE_TRAIL_9.pdf ; http://tribune.com.pk/story/875467/poached-and-rescued-504-turtles-released-at-head-balloki/,,,,,,,,,,,,,,,,,,,
24-Apr-15,Black Pond Turtles,Cochin Airport,"Kerala, India","Kerala, India",,"Kuala Lumpur, Malaysia",,29,,,Luggage,,,The Customs department at Cochin Airport in Kerala seized 29 Black Pond Turtles (CITES I) from Mohammad Beeran (52). Beeran was on his way to Kuala Lumpur. The turtles were found in his check-in baggage and had been sedated. Beeran claimed he was innocent and had been tricked into smuggling the turtles.,http://www.robindesbois.org/wp-content/uploads/ON_THE_TRAIL_9.pdf; Omega 12; http://www.business-standard.com/video-gallery/general/tortoises-and-peacock-feathers-seized-by-Customs-in-kerala-19880.htm,,,,,,,,,,,,,,,,,,,
26-Apr-15,Black Pond Turtles,Chatrapati Shivaji Airport,"Mumbai, India","Mumbai, India",,"Kuala Lumpur, Malaysia",,161,,,Luggage,,Cardboard boxes,"161 Black Pond Turtles (CITES I) were discovered in two cardboard cartons destined for Kuala Lumpur, Malaysia. Two men (Thimmarayappa Jnanamurthy and Ramaswamy Shanmugan) were arrested. They were attempting to smuggle the turtles in their check-in luggage.",http://www.hindustantimes.com/mumbai/second-seizure-Customs-finds-161-turtles-at-mumbai-airport/story-AlOv7bmtDeO1XvLD8f5k1K.html,,,,,,,,,,,,,,,,,,,
25-Apr-15,Indian Star Tortoises,,,,,Bangladesh,,21,,,Unknown,,,,http://www.robindesbois.org/wp-content/uploads/ON_THE_TRAIL_9.pdf,,,,,,,,,,,,,,,,,,,
25-May-15,Asian Brown Pond Turtles; Japanese Pond Turtles,Chubu Airport,"Nagoya, Japan","Nagoya, Japan",,,,400,,,Luggage,,,Asian Brown Pond Turtles (CITES II). Japanese Pond Turtles (CITES II) Turtles were bundled belly to belly and stuffed in socks. Two arrests,TRAFFIC Bulletin 1997 - 2016; https://exposingthebiggame.wordpress.com/2015/05/page/3/,,,,,,,,,,,,,,,,,,,
29-May-15,Black Pond Turtles,Shahjalal Airport,"Dhaka, Bangladesh",,,"Kuala Lumpur, Malaysia",,130,Malaysia Airlines,,Luggage,Tip-off,Wrapped in cloth and plastic in a suitcase(s),130 Black Pond Turtles (CITES I) were seized by the Customs Intelligence Department on a tip off. Turtles became the property of the Bangladesh Forest Department and were taken to Bangabandhu Safari Park in Gazipur. No arrests.,http://www.robindesbois.org/wp-content/uploads/ON_THE_TRAIL_9.pdf ; http://www.thedailystar.net/country/130-turtles-seized-dhaka-airport-89407,,,,,,,,,,,,,,,,,,,
1-Jun-15,Radiated Tortoises,Ivato Airport,"Antananarivo, Madagascar","Antananarivo, Madagascar","Nairobi, Kenya; Khartoum, Sudan ",China,,453,Kenya Airways,,Luggage,,,Radiated Tortoises (CITES I) were found in the luggage of an Egyptian passenger. ,,,,,,,,,,,,,,,,,,,,
1-Jun-15,Russell's Vipers; Chochin Forest Cane Turtles; Chameleons,Cochin Airport,"Kerala, India","Kerala, India",,,,,,,Unknown,,,Cochin Forest Cane Turtle (CITES II). Two Japanese suspects arrested. Theyboth worked in a Japanese supermarket and took footage that they intended to sell to japanese TV networks,http://www.robindesbois.org/wp-content/uploads/ON_THE_TRAIL_9.pdf,,,,,,,,,,,,,,,,,,,
20-Jun-15,Turtles,Ivato Airport,"Antananarivo, Madagascar","Antananarivo, Madagascar","Nairobi, Kenya","Khartoum, Sudan",,403,,,Luggage,,Wrapped in cloth bags placed in 8 suitcases,The Egyptian national had arrived in Antananarivo 48 hours earlier; suspicions were aroused by the short duration of the stay; the police think the suspect hoped to get easily out of Malagasy territory during the strike of the Air Madagascar employees which was disrupting the operation of the airport,http://www.sciencesetavenir.fr/animaux/20150622.OBS1253/saisie-record-de-tortues-a-madagascar.html,,,,,,,,,,,,,,,,,,,
28-Jun-15,Black Pond Turtles,Bengaluru Airport,"Bangalore, India","Bangalore, India","Kuala Lumpur, Malaysia","Phuket, Thailand",,72,Malaysia Airlines,,Luggage,Scanner,Covered in cardboard and pillow covers in two suitcases,"Black pond turtles (CITES I) in two black suitcases. Central Industrial Security Forces (CISF) officials noticed movement in the suitcase through the scanner. The officials opened the suitcases and found the turtles covered in cardboard and pillow covers, with their legs taped together. The Two suspects (Haroon Rashid and Mohammed Ali, alias Imran Khan) caught. They claimed that their contact in Chennai had asked them to take the turtles to someone in Phuket, Thailand. They had been given Rs. 10,000 and free tickets to hand over the bags. Due to increased surveillance at Chennai Airport, traffickers left from Bangalore. The turtles had traveled from Calcutta to Chennai via boat. An investigation was begun to find the duo's contact in Chennai.",http://www.robindesbois.org/wp-content/uploads/ON_THE_TRAIL_9.pdf ; http://www.thehindu.com/news/cities/bangalore/terrapin-smuggling-racket-busted-two-held/article7368630.ece ; http://www.deccanchronicle.com/150630/nation-crime/article/72-spotted-black-terrapins-stuffed-2-suitcases-seized-kia,,,,,,,,,,,,,,,,,,,
28-Jun-15,Black Pond Turtles,Chennai Airport,"Chennai, India","Chennai, India",,"Kuala Lumpur, Malaysia",,54,Malaysia Airlines,,Luggage,Scanner,,"54 Indian Star Tortoises (CITES II) from Malaysia-bound passenger. Customs officials saw movement in the baggage scan, opened the bags and found the turtles. The suspect (Mohammad Ali, 45) said he was staying in a hotel in Chennai, and had been approached by two people at the airport to deliver the bag containing the turtles to a contact in Kuala Lumpur for Rs. 3000.",http://www.robindesbois.org/wp-content/uploads/ON_THE_TRAIL_9.pdf ; http://www.dinakaran.com/News_Detail.asp?Nid=153139,,,,,,,,,,,,,,,,,,,
1-Jul-15,Mangrove Monitor Lizards,Francisco Bangoy Airport,"Davao, Phillippines","Davao, Phillippines",,"Caloocan, Phillippines",,2,,,Airfreight,,,Mangrove Monitor Lizards (CITES II). The lizards were recoverd alive.,http://www.robindesbois.org/wp-content/uploads/ON_THE_TRAIL_10.pdf,,,,,,,,,,,,,,,,,,,
2-Jul-15,Indian Star Tortoises,Chennai Airport,"Chennai, India","Chennai, India",,"Kuala Lumpur, Malaysia",,64,Malaysia Airlines,,Luggage,,,60 or 64 Indian Star Tortoises (CITES II). Naina Mohammed Yasin was arrested by Customs officials. ,TRAFFIC Bulletin 1997 - 2016; http://www.business-standard.com/article/pti-stories/64-star-tortoises-seized-man-detained-at-airport-115070200851_1.html,,,,,,,,,,,,,,,,,,,
3-Jul-15,Sea Turtles,Bandaranaike Airport,"Colombo, Sri Lanka","Colombo, Sri Lanka",,Malaysia,,125,,,Unknown,,,One arrest,http://www.robindesbois.org/wp-content/uploads/ON_THE_TRAIL_10.pdf,,,,,,,,,,,,,,,,,,,
5-Jul-15,Black Pond Turtles,Shahjahal Airport,"Dhaka, Bangladesh","Dhaka, Bangladesh",,,,400,,,Airfreight,,,"Black pond turtles (CITES I). The shipping company was Mamun International. A company under the same name is based in Nagpur, Maharashtra which specializes in manufacturing plastic products. The turtles were packed into 53 plastic containers. One arrest.",http://www.robindesbois.org/wp-content/uploads/ON_THE_TRAIL_10.pdf,,,,,,,,,,,,,,,,,,,
8-Jul-15,Indian Star Tortoises,Chennai Airport,"Chennai, India","Chennai, India",,"Kuala Lumpur, Malaysia",,41,Malaysia Airlines,,Luggage,Scanner,,"41 Indian Star Tortoises (CITES II). A CISF official noticed small objects moving within the luggage of Saddam Hussain (25). The official alerted Customs officers, who found 41 tortoises inside. This seizure prompted the Forest Department to begin investigating all the cases of turtle trafficking from Chennai to Kuala Lumpur to see if they were linked. From the article on the seizure: ""There are usually 10-12 seizures every year where protected animals are found in passengers bags, satchels and even belts which are then handed over to the forest department, with the majority of  the seizures being star tortoises, followed by sea-horses....SMUGGLING ROUTE: The major smuggling points for star tortoises are from Bengal, Odisha, Andhra Pradesh and coastal Tamil Nadu
LOADED LUGGAGE: Star tortoises can be kept in confined places like suitcases and taken for long journeys without any harm done to them for up to 4-6 hours""",TRAFFIC Bulletin 1997 - 2016 ; http://www.newindianexpress.com/cities/chennai/Tortoises-Seized-Again-at-Airport/2015/07/09/article2910207.ece,,,,,,,,,,,,,,,,,,,
9-Jul-15,Black Pond Turtles,Changi Airport,Singapore,Bangladesh,Singapore,"Surabaya, Indonesia",,206,,,Luggage,,,Black Pond Turtles (CITES I) 27 of the turtles died after being found. 2 Russian nationals were arrested and sentenced.,TRAFFIC Bulletin 1997 - 2016,,,,,,,,,,,,,,,,,,,
9-Jul-15,Indian Star Tortoises,Chennai Airport,"Chennai, India",,,"Kuala Lumpur, Malaysia",,100,,,Luggage,Scanner,,100 or 130 Indian Star Tortoises (CITES II) and two people (Suleiman Mohammad and Leila Banu) were arrested. Officials found the tortoises in their luggage during the baggage scan.,http://www.thehindu.com/todays-paper/tp-national/tp-tamilnadu/star-tortoises-seized-at-airport/article7405649.ece ; http://www.deccanchronicle.com/150710/nation-crime/article/star-tortoise-smuggling-goes,,,,,,,,,,,,,,,,,,,
12-Jul-15,Black Pond Turtles,Shahjahal Airport,"Dhaka, Bangladesh","Dhaka, Bangladesh",,Vietnam,,557,,,Luggage,,,Black Pond turtles (CITES I) were packed into 5 bags. The bag carriers fled.,http://www.robindesbois.org/wp-content/uploads/ON_THE_TRAIL_10.pdf,,,,,,,,,,,,,,,,,,,
25-Jul-15,Indian Star Tortoises,Chennai Airport,"Chennai, India","Chennai, India",,Malaysia,,50,,,Luggage,,,Indian Star Tortoises (CITES II),TRAFFIC Bulletin 1997 - 2016,,,,,,,,,,,,,,,,,,,
1-Aug-15,Black Pond Turtles,Chennai Airport,"Chennai, India","Chennai, India",,"Kuala Lumpur, Malaysia",,138,,,Unknown,,,Black pond turtles (CITES I) One arrest of an Indian street vendor.,http://www.robindesbois.org/wp-content/uploads/ON_THE_TRAIL_10.pdf,,,,,,,,,,,,,,,,,,,
1-Aug-15,Indian Star Tortoises,Cochin Airport,"Kerala, India","Kerala, India",,Malaysia,,199,,,Unknown,,,Indian Star Tortoises (CITES II). One arrest,http://www.robindesbois.org/wp-content/uploads/ON_THE_TRAIL_10.pdf,,,,,,,,,,,,,,,,,,,
1-Aug-15,Indian Star Tortoises; Black Pond Turtles,Bengaluru Airport,"Bangalore, India","Bangalore, India",,Malaysia,,79,Malaysian Airlines,,Unknown,,,"Indian Star Tortoises (CITES II), Black Pond Turtles (CITES I). Two arrests, both smugglers were from Chennai, India. Their tickets were paid for by the 'network head' and were to recieve $150 bonuses.",http://www.robindesbois.org/wp-content/uploads/ON_THE_TRAIL_10.pdf,,,,,,,,,,,,,,,,,,,
4-Aug-15,Radiated Tortoises,Guangzhou Airport,"Guangzhou, China",Madagascar,,"Guangzhou, China",,298,,,Luggage,,,Radiated Tortoises (CITES I). Two arrests. An airport employee reprotedly assisted the pair in clearing Customs.,TRAFFIC Bulletin 1997 - 2016,,,,,,,,,,,,,,,,,,,
9-Aug-15,Indian Star Tortoises; spotted black terrapins,Bengaluru Airport,"Bangalore, India","Bangalore, India",India,Malaysia,,79,Malaysian Airlines,,Luggage,,,"Indian Star Tortoises (CITES II) Spotted Black Terrapins (CITES I) Two arrests. The animals had been taped to restrict movement. They had traveled from Chennai and were bound for Kuala Lumpur. Apparently, the duo had been enticed by an offer of payment and a free flight to Malaysia in exchange for carrying the luggage.",TRAFFIC Bulletin 1997 - 2016; http://www.bangaloremirror.com/bangalore/crime/2-held-for-attempt-to-smuggle-protected-wildlife-from-India/articleshow/48473927.cms,,,,,,,,,,,,,,,,,,,
10-Aug-15,Indian Star Tortoises,Cochin Airport,"Kerala, India","Kerala, India",,,,199,,,Unknown,,,Indian Star Tortoises (CITES II). One arrest,http://www.robindesbois.org/wp-content/uploads/ON_THE_TRAIL_10.pdf; TRAFFIC Bulletin,,,,,,,,,,,,,,,,,,,
14-Aug-15,Reticulated Python Gall Bladders,Xiamen Airport,"Xiamen, China","Xiamen, China",,,,182,,,Luggage,X-ray,,Reticulated Python (CITES II) One arrest of a Chinese national,TRAFFIC Bulletin 1997 - 2016,,,,,,,,,,,,,,,,,,,
25-Aug-15,Stuffed Crocodile,Qingdao Liutung Airport,"Qingdao, China",,,"Qingdao, China",,1,,,Unknown,,,Crocodile (CITES I/II),http://www.robindesbois.org/wp-content/uploads/ON_THE_TRAIL_10.pdf,,,,,,,,,,,,,,,,,,,
1-Sep-15,Indian Star Tortoises,Chennai Airport,"Chennai, India",,,,,276,,,Unknown,,,Indian Star Tortoises (CITES II) One arrest.,http://www.robindesbois.org/wp-content/uploads/ON_THE_TRAIL_10.pdf,,,,,,,,,,,,,,,,,,,
8-Sep-15,Black Spotted Turtles,Allama Iqbal Airport,"Lahore, Pakistan","Lahore, Pakistan",,"Thailand, Bangkok",,120,,,Unknown,,Hidden in baby diapers,Black spotted Turtles (CITES I) were discovered being smuggled by a Pakistani man with previous wildlife smuggling charges.,http://www.dailytimes.com.pk/national/08-Sep-2015/Customs-officials-foil-smuggling-bid-recover-120-rare-turtles; http://www.pakistantoday.com.pk/2015/09/08/national/customs-officials-foil-smuggling-bid-recover-120-rare-turtles-at-lahore-airport/,,,,,,,,,,,,,,,,,,,
28-Sep-15,Ploughshare Tortoises; Radiated Tortoises,Ivato Airport,"Antananarivo, Madagascar","Antananarivo, Madagascar",Mauritius,"Kuala Lumpur, Malaysia",,771,,,Airfreight,,Hidden in socks/stockings in diapers in two wood crates,"8 Ploughshare Tortoises (CITES I), 763 Radiated Tortoises (CITES I). 20 Radiated tortoises died afterwards. The turtles were hidden in socks/stockings in diapers and undeclared in two wooden crates bound for Kuala Lumpur.",TRAFFIC Bulletin 1997 - 2016 ; http://www.elcomercio.com/tendencias/incautacion-madagascar-crias-tortugas-traficodeespecies.html,,,,,,,,,,,,,,,,,,,
29-Sep-15,Indian Star Tortoises,Madurai Airport,"Madurai, India","Madurai, India",Sri Lanka,Malaysia,,247,,,Luggage,,,Indian Star tortoises (CITES II). One arrest. The suspect had already been implicated in ketamine smuggling.,http://www.robindesbois.org/wp-content/uploads/ON_THE_TRAIL_10.pdf,,,,,,,,,,,,,,,,,,,
